{
  "activation_id": "ACT-W00-REPOSITORY-GOVERNANCE-v3",
  "artifacts": {
    "BINARY_DIFF": {
      "path": "handoffs/W00/evidence/W00-SOL-REPAIR05-20260819T144854Z/implementation.diff",
      "sha256": "e3ad52887425a5a955593ac1735ad17f9e598b7d2551c95329954923fe0df72b"
    },
    "COMPLEXITY": {
      "path": "handoffs/W00/evidence/W00-SOL-REPAIR05-20260819T144854Z/complexity.json",
      "sha256": "038bbfc800766c671e0ea608f3f2a464ef58ea044c65bb864282b5fda712e4e0"
    },
    "REVIEW_INSTRUCTION": {
      "path": "handoffs/W00/evidence/W00-SOL-REPAIR05-20260819T144854Z/review.prompt.md",
      "sha256": "1bbd08d7d1db908820bb4865ec265b3abf0fc0ecabb4af16504d3bc34ba65858"
    },
    "REVIEW_REPORT_RECORD": {
      "path": "handoffs/W00/evidence/W00-SOL-REPAIR05-20260819T144854Z/review.report.json",
      "sha256": "f2e1e528539e882e403c1dfe506866fd7c0d89d619e97cc8bbfe7e4aa1c5c5ef"
    }
  },
  "base_sha": "3d3ebb706fe6c8779445cbbfd9fea271b86d3646",
  "branch": "codex/w00-repository-governance",
  "changes": [
    {
      "kind": "ADD",
      "path": ".github/workflows/governance-integrity.yml",
      "reason": "W00A1A_IMPLEMENTATION"
    },
    {
      "kind": "ADD",
      "path": "governance/handoff-registry.json",
      "reason": "W00A1A_IMPLEMENTATION"
    },
    {
      "kind": "ADD",
      "path": "governance/schemas/w00a1a-handoff.schema.json",
      "reason": "W00A1A_IMPLEMENTATION"
    },
    {
      "kind": "ADD",
      "path": "governance/test_w00_checks.py",
      "reason": "W00A1A_IMPLEMENTATION"
    },
    {
      "kind": "ADD",
      "path": "governance/w00_checks.py",
      "reason": "W00A1A_IMPLEMENTATION"
    },
    {
      "kind": "ADD",
      "path": "handoffs/W00/W00-SOL-20260817T234806Z.json",
      "reason": "IMMUTABLE_HANDOFF_HISTORY"
    },
    {
      "kind": "ADD",
      "path": "handoffs/W00/W00-SOL-20260817T234806Z.md",
      "reason": "IMMUTABLE_HANDOFF_HISTORY"
    },
    {
      "kind": "ADD",
      "path": "handoffs/W00/W00-SOL-REPAIR01-20260818T021301Z.json",
      "reason": "IMMUTABLE_HANDOFF_HISTORY"
    },
    {
      "kind": "ADD",
      "path": "handoffs/W00/W00-SOL-REPAIR01-20260818T021301Z.md",
      "reason": "IMMUTABLE_HANDOFF_HISTORY"
    },
    {
      "kind": "ADD",
      "path": "handoffs/W00/W00-SOL-REPAIR02-20260818T141853Z.json",
      "reason": "IMMUTABLE_HANDOFF_HISTORY"
    },
    {
      "kind": "ADD",
      "path": "handoffs/W00/W00-SOL-REPAIR02-20260818T141853Z.md",
      "reason": "IMMUTABLE_HANDOFF_HISTORY"
    },
    {
      "kind": "ADD",
      "path": "handoffs/W00/W00-SOL-REPAIR03-20260818T230834Z.json",
      "reason": "IMMUTABLE_HANDOFF_HISTORY"
    },
    {
      "kind": "ADD",
      "path": "handoffs/W00/W00-SOL-REPAIR03-20260818T230834Z.md",
      "reason": "IMMUTABLE_HANDOFF_HISTORY"
    },
    {
      "kind": "ADD",
      "path": "handoffs/W00/W00-SOL-REPAIR04-20260819T025659Z.json",
      "reason": "IMMUTABLE_HANDOFF_HISTORY"
    },
    {
      "kind": "ADD",
      "path": "handoffs/W00/W00-SOL-REPAIR04-20260819T025659Z.md",
      "reason": "IMMUTABLE_HANDOFF_HISTORY"
    },
    {
      "kind": "ADD",
      "path": "handoffs/W00/evidence/W00-SOL-REPAIR04-20260819T025659Z/01.receipt.json",
      "reason": "IMMUTABLE_HANDOFF_HISTORY"
    },
    {
      "kind": "ADD",
      "path": "handoffs/W00/evidence/W00-SOL-REPAIR04-20260819T025659Z/01.stderr",
      "reason": "IMMUTABLE_HANDOFF_HISTORY"
    },
    {
      "kind": "ADD",
      "path": "handoffs/W00/evidence/W00-SOL-REPAIR04-20260819T025659Z/01.stdout",
      "reason": "IMMUTABLE_HANDOFF_HISTORY"
    },
    {
      "kind": "ADD",
      "path": "handoffs/W00/evidence/W00-SOL-REPAIR04-20260819T025659Z/02.receipt.json",
      "reason": "IMMUTABLE_HANDOFF_HISTORY"
    },
    {
      "kind": "ADD",
      "path": "handoffs/W00/evidence/W00-SOL-REPAIR04-20260819T025659Z/02.stderr",
      "reason": "IMMUTABLE_HANDOFF_HISTORY"
    },
    {
      "kind": "ADD",
      "path": "handoffs/W00/evidence/W00-SOL-REPAIR04-20260819T025659Z/02.stdout",
      "reason": "IMMUTABLE_HANDOFF_HISTORY"
    },
    {
      "kind": "ADD",
      "path": "handoffs/W00/evidence/W00-SOL-REPAIR04-20260819T025659Z/03.receipt.json",
      "reason": "IMMUTABLE_HANDOFF_HISTORY"
    },
    {
      "kind": "ADD",
      "path": "handoffs/W00/evidence/W00-SOL-REPAIR04-20260819T025659Z/03.stderr",
      "reason": "IMMUTABLE_HANDOFF_HISTORY"
    },
    {
      "kind": "ADD",
      "path": "handoffs/W00/evidence/W00-SOL-REPAIR04-20260819T025659Z/03.stdout",
      "reason": "IMMUTABLE_HANDOFF_HISTORY"
    },
    {
      "kind": "ADD",
      "path": "handoffs/W00/evidence/W00-SOL-REPAIR04-20260819T025659Z/04.receipt.json",
      "reason": "IMMUTABLE_HANDOFF_HISTORY"
    },
    {
      "kind": "ADD",
      "path": "handoffs/W00/evidence/W00-SOL-REPAIR04-20260819T025659Z/04.stderr",
      "reason": "IMMUTABLE_HANDOFF_HISTORY"
    },
    {
      "kind": "ADD",
      "path": "handoffs/W00/evidence/W00-SOL-REPAIR04-20260819T025659Z/04.stdout",
      "reason": "IMMUTABLE_HANDOFF_HISTORY"
    },
    {
      "kind": "ADD",
      "path": "handoffs/W00/evidence/W00-SOL-REPAIR04-20260819T025659Z/05.receipt.json",
      "reason": "IMMUTABLE_HANDOFF_HISTORY"
    },
    {
      "kind": "ADD",
      "path": "handoffs/W00/evidence/W00-SOL-REPAIR04-20260819T025659Z/05.stderr",
      "reason": "IMMUTABLE_HANDOFF_HISTORY"
    },
    {
      "kind": "ADD",
      "path": "handoffs/W00/evidence/W00-SOL-REPAIR04-20260819T025659Z/05.stdout",
      "reason": "IMMUTABLE_HANDOFF_HISTORY"
    },
    {
      "kind": "ADD",
      "path": "handoffs/W00/evidence/W00-SOL-REPAIR04-20260819T025659Z/06.receipt.json",
      "reason": "IMMUTABLE_HANDOFF_HISTORY"
    },
    {
      "kind": "ADD",
      "path": "handoffs/W00/evidence/W00-SOL-REPAIR04-20260819T025659Z/06.stderr",
      "reason": "IMMUTABLE_HANDOFF_HISTORY"
    },
    {
      "kind": "ADD",
      "path": "handoffs/W00/evidence/W00-SOL-REPAIR04-20260819T025659Z/06.stdout",
      "reason": "IMMUTABLE_HANDOFF_HISTORY"
    },
    {
      "kind": "ADD",
      "path": "handoffs/W00/evidence/W00-SOL-REPAIR04-20260819T025659Z/07.receipt.json",
      "reason": "IMMUTABLE_HANDOFF_HISTORY"
    },
    {
      "kind": "ADD",
      "path": "handoffs/W00/evidence/W00-SOL-REPAIR04-20260819T025659Z/07.stderr",
      "reason": "IMMUTABLE_HANDOFF_HISTORY"
    },
    {
      "kind": "ADD",
      "path": "handoffs/W00/evidence/W00-SOL-REPAIR04-20260819T025659Z/07.stdout",
      "reason": "IMMUTABLE_HANDOFF_HISTORY"
    },
    {
      "kind": "ADD",
      "path": "handoffs/W00/evidence/W00-SOL-REPAIR04-20260819T025659Z/08.receipt.json",
      "reason": "IMMUTABLE_HANDOFF_HISTORY"
    },
    {
      "kind": "ADD",
      "path": "handoffs/W00/evidence/W00-SOL-REPAIR04-20260819T025659Z/08.stderr",
      "reason": "IMMUTABLE_HANDOFF_HISTORY"
    },
    {
      "kind": "ADD",
      "path": "handoffs/W00/evidence/W00-SOL-REPAIR04-20260819T025659Z/08.stdout",
      "reason": "IMMUTABLE_HANDOFF_HISTORY"
    },
    {
      "kind": "ADD",
      "path": "handoffs/W00/evidence/W00-SOL-REPAIR04-20260819T025659Z/09.receipt.json",
      "reason": "IMMUTABLE_HANDOFF_HISTORY"
    },
    {
      "kind": "ADD",
      "path": "handoffs/W00/evidence/W00-SOL-REPAIR04-20260819T025659Z/09.stderr",
      "reason": "IMMUTABLE_HANDOFF_HISTORY"
    },
    {
      "kind": "ADD",
      "path": "handoffs/W00/evidence/W00-SOL-REPAIR04-20260819T025659Z/09.stdout",
      "reason": "IMMUTABLE_HANDOFF_HISTORY"
    },
    {
      "kind": "ADD",
      "path": "handoffs/W00/evidence/W00-SOL-REPAIR04-20260819T025659Z/10.receipt.json",
      "reason": "IMMUTABLE_HANDOFF_HISTORY"
    },
    {
      "kind": "ADD",
      "path": "handoffs/W00/evidence/W00-SOL-REPAIR04-20260819T025659Z/10.stderr",
      "reason": "IMMUTABLE_HANDOFF_HISTORY"
    },
    {
      "kind": "ADD",
      "path": "handoffs/W00/evidence/W00-SOL-REPAIR04-20260819T025659Z/10.stdout",
      "reason": "IMMUTABLE_HANDOFF_HISTORY"
    },
    {
      "kind": "ADD",
      "path": "handoffs/W00/evidence/W00-SOL-REPAIR04-20260819T025659Z/auth.auth.json",
      "reason": "IMMUTABLE_HANDOFF_HISTORY"
    },
    {
      "kind": "ADD",
      "path": "handoffs/W00/evidence/W00-SOL-REPAIR04-20260819T025659Z/review.json",
      "reason": "IMMUTABLE_HANDOFF_HISTORY"
    },
    {
      "kind": "ADD",
      "path": "handoffs/W00/evidence/W00-SOL-REPAIR04-20260819T025659Z/validation.json",
      "reason": "IMMUTABLE_HANDOFF_HISTORY"
    }
  ],
  "commands": [
    {
      "activation_id": "ACT-W00-REPOSITORY-GOVERNANCE-v3",
      "argv": [
        "uv",
        "run",
        "--with=jsonschema==4.25.1",
        "--with=coverage==7.10.6",
        "python3",
        "-B",
        "-m",
        "coverage",
        "run",
        "--data-file=/tmp/bsl-w00a1a-repair05.coverage",
        "--branch",
        "-m",
        "unittest",
        "governance/test_w00_checks.py"
      ],
      "command_index": 1,
      "evidence_id": "R05_CMD_01",
      "execution_evidence_level": "LOCAL_CAPTURED",
      "exit_code": 0,
      "finished_at_utc": "2026-08-19T15:14:06Z",
      "implementation_head_sha": "1e626d095426dade15b2df8c80ad7b5ae7f5ddf1",
      "receipt": {
        "path": "handoffs/W00/evidence/W00-SOL-REPAIR05-20260819T144854Z/01.receipt.json",
        "sha256": "4b43f61cbf3c3bf3ac27f50d13d3390091193c94ccfebe88eb8e0a4aefe4c538"
      },
      "root_turn_id": "W00-SOL-REPAIR05-20260819T144854Z",
      "started_at_utc": "2026-08-19T15:13:47Z",
      "stderr": {
        "path": "handoffs/W00/evidence/W00-SOL-REPAIR05-20260819T144854Z/01.stderr",
        "sha256": "1a9e8329f52179f37d5d6c03aea1b70dd0e1c1e0a7a4308f54e359b2d37a21fd"
      },
      "stdout": {
        "path": "handoffs/W00/evidence/W00-SOL-REPAIR05-20260819T144854Z/01.stdout",
        "sha256": "e3b0c44298fc1c149afbf4c8996fb92427ae41e4649b934ca495991b7852b855"
      },
      "working_directory": "."
    },
    {
      "activation_id": "ACT-W00-REPOSITORY-GOVERNANCE-v3",